post_url,post_date,text,total_reactions,likes,love,celebrate,comments,reposts,media_urls
https://www.linkedin.com/posts/ford-motor-company_weareford-facesofford-fordaustralia-activity-7300276270087426049-EPQk?utm_source=social_share_send&utm_medium=member_desktop_web&rcm=ACoAAFqVoVQBwS5V984XVmuyo77EUIIce7rnpa0,2025-02-25 23:11:35,"“Having the opportunity to sculpt unique designs in clay, dress the models up, photograph them and then document the presentation and design review is an incredibly rewarding process,” says Nicholas Horan, senior clay modeler and photographer with Ford Australia.   It’s a job that brings several of his talents and interests together and he couldn’t be happier. Find out more about Nick’s career – as well as which movie quote he leans on to keep his work-life balance on track.  Looking for a job that brings your passion and skills together? Find it at www.careers.ford.com.   #WeAreFord #FacesOfFord #FordAustralia #FordDesign",378,347,17,13,25,17,
https://www.linkedin.com/posts/ford-motor-company_weareford-nsbe-georgiatech-activity-7299796958179659779-HB67?utm_source=social_share_send&utm_medium=member_desktop_web&rcm=ACoAAFqVoVQBwS5V984XVmuyo77EUIIce7rnpa0,2025-02-24 15:26:58,"“I love how welcoming everyone is and how helpful my team was when I first joined the company,” says engineer Morgan Wright. “Ford does a great job at giving you the tools you need to succeed and surrounds you with people to help you accomplish your goals.”  She recently began her Ford career as part of the Ford College Graduate developmental program, which will allow her to work in several areas of Product Development during her first few years here.  Morgan was an active member of the Georgia Institute of Technology chapter of NSBE as a student and plans to join the professional chapter in Detroit. She’s excited to attend the NSBE convention as a recruiter this year and can’t wait to meet everyone.   Stop by the booth to meet Morgan and the rest of the Ford team in Chicago to learn more about her transition from student to automotive engineer! March 5-9 at McCormick Place.   Learn more about how you can put your career in drive at http://spr.ly/6040LM7L6   #WeAreFord #NSBE #GeorgiaTech #GTSBE",260,231,11,13,15,12,"https://media.licdn.com/dms/image/v2/D4D10AQGsDU1wGOTg-A/image-shrink_1280/B4DZU4Wm.HGkAM-/0/1740407207042?e=1747479600&v=beta&t=No3o9K27ZYluovAVmu2a-frBIwl1As5pf78Kkr2Jl4w, https://media.licdn.com/dms/image/v2/D4D10AQFVnh8k26jc-g/image-shrink_1280/B4DZU4WnMpHAAM-/0/1740407207432?e=1747479600&v=beta&t=DEFLO-xdsGSKFF7so-xLVqqF5LeTkCoeJx2x3zK9nSE, https://media.licdn.com/dms/image/v2/D4D10AQFC9RLeZSlY6Q/image-shrink_1280/B4DZU4WnYeHAAY-/0/1740407207794?e=1747479600&v=beta&t=85zrtL_0snEOdqiIIekAfElfJaF_i7gy4EizU5mQU9I"
https://www.linkedin.com/posts/ford-motor-company_why-do-we-employ-the-most-hourly-autoworkers-activity-7313907236441923586-ea0z?utm_source=social_share_send&utm_medium=member_desktop_web&rcm=ACoAAFqVoVQBwS5V984XVmuyo77EUIIce7rnpa0,2025-04-04 14:56:10,"Why do we employ the most hourly autoworkers in the country? Why do we assemble the most vehicles in the country? Because we’re committed to doing what’s right for the country.   Ford Motor Company. From America, for America.",1977,1747,113,97,71,222,https://dms.licdn.com/playlist/vid/v2/D5605AQF7LWmr_C9mAQ/mp4-720p-30fp-crf28/B56ZYA3yh5GoBg-/0/1743771367922?e=1747479600&v=beta&t=XAib5R0_LHhnTOMlzQOWxvt5rueboWNrdtElzKYtDNE
https://www.linkedin.com/posts/ford-motor-company_weareford-nsbe-activity-7297297092580888576-uU4m?utm_source=social_share_send&utm_medium=member_desktop_web&rcm=ACoAAFqVoVQBwS5V984XVmuyo77EUIIce7rnpa0,2025-02-17 17:53:24,"“I’ve seen firsthand Ford’s commitment to innovation. Working here is more than just a job. It’s a legacy,” says Luree Brown, experience strategy lead at Ford and longtime member of the National Society of Black Engineers (NSBE).  Ten years ago, Luree started in Manufacturing launching new vehicles and then moved to Customer Experience. She’s the fourth generation of her family to work at Ford, and says, “It’s a place where you can build a lasting career, contribute to iconic vehicles, and create memorable customer experiences.”  She’s been part of NSBE even longer than she’s been part of Ford: her first NSBE national conference was in 2008 and for the last five years, she’s been on the other side of the booth as a recruiter. “Whether you’re a potential candidate interested in joining our team or a future customer that’s interested in our new lineup, I can’t wait to connect in Chicago,” Luree says.  Luree and the Ford team will be at booth 2244 in Chicago from March 5-9. Stop by and find out how you can move the world and make the future with us! #WeAreFord #NSBE",451,373,29,45,28,7,"https://media.licdn.com/dms/image/v2/D5610AQGlvlYNq7gTFA/image-shrink_1280/B56ZUU1BSTGsAM-/0/1739811199614?e=1747479600&v=beta&t=Gqq9kGMwrvU3eRL2S_047bOPeV0ESItV8UY0nQ38phk, https://media.licdn.com/dms/image/v2/D5610AQGzvcd6TqBW3Q/image-shrink_1280/B56ZUU1BnsGsAM-/0/1739811200609?e=1747479600&v=beta&t=jyJUgI1ECkU3QxKT9aGslb_YyieBxS1R4vOn4yQdMx8, https://media.licdn.com/dms/image/v2/D5610AQExTYLlPsDozA/image-shrink_1280/B56ZUU1BxWHoBU-/0/1739811201451?e=1747479600&v=beta&t=dV5VZ47skNoHkLoZU5WhoJg6YXL92roMQPLw2bP1JVE, https://media.licdn.com/dms/image/v2/D5610AQH2a6v3BxiQYg/image-shrink_1280/B56ZUU1B7xHQAM-/0/1739811201767?e=1747479600&v=beta&t=ijeAk7xaxJknUwlIEHe4rSvvTN2cyGRI9tpTH1A71UU, https://media.licdn.com/dms/image/v2/D5610AQElmemmBO5jCQ/image-shrink_1280/B56ZUU1CNFGsAM-/0/1739811202856?e=1747479600&v=beta&t=aQP2gtYxHA0kyRHyqzPOod4LVhkFgCE_Sc1heJalZSY"
https://www.linkedin.com/posts/ford-motor-company_weareford-nsbe2025-activity-7302815212443680768-UrU3?utm_source=social_share_send&utm_medium=member_desktop_web&rcm=ACoAAFqVoVQBwS5V984XVmuyo77EUIIce7rnpa0,2025-03-04 23:20:26,See you in Chicago! 🚘🎉     #WeAreFord #NSBE,193,175,9,3,12,8,
https://www.linkedin.com/posts/ford-motor-company_rallytoread-fordsouthafrica-activity-7302719732850274305-aPkh?utm_source=social_share_send&utm_medium=member_desktop_web&rcm=ACoAAFqVoVQBwS5V984XVmuyo77EUIIce7rnpa0,2025-03-04 17:01:02,"In celebration of National Reading Month here in the U.S., we wanted to share this great story from Ford Motor Company of Southern Africa!      #WeAreFord  #FordSouthAfrica",177,155,9,9,7,6,
https://www.linkedin.com/posts/ford-motor-company_ford-new-hire-hunter-industrial-controls-activity-7312847709814562818--9FO?utm_source=social_share_send&utm_medium=member_desktop_web&rcm=ACoAAFqVoVQBwS5V984XVmuyo77EUIIce7rnpa0,2025-04-01 16:46:00,"Meet Hunter Wojcik, industrial controls engineer and new Ford hire! Hunter is excited to be the third generation in his family to be part of the company. Welcome!  Would you like to start your own family tradition? Learn more about our current opportunities at http://spr.ly/6046FV4jK.   #WeAreFord #NewHireSpotlight",172,158,8,5,15,7,https://dms.licdn.com/playlist/vid/v2/D5610AQHTTvMyotFrcw/mp4-720p-30fp-crf28/B56ZXx0IAPGcBs-/0/1743518756284?e=1747479600&v=beta&t=_zu8_pPLajkA7_qf2CUQlK5xIor7o377_yDzwsC4_Io
https://www.linkedin.com/posts/ford-motor-company_togetherfordever-2025-activity-7296166637735489536-uYFH?utm_source=social_share_send&utm_medium=member_desktop_web&rcm=ACoAAFqVoVQBwS5V984XVmuyo77EUIIce7rnpa0,2025-02-14 15:01:22,"Happy Valentine’s Day! At a company our size, you’re bound to know couples who both work for Ford. Today we’re highlighting four of them who have found true love Fordever – how they met, what they do and what they love about working for the same company.   Thanks to Carol and Edgar, Lisa and Rakesh, Marcia and Sam, and Amanda and RJ, for sharing their love stories!  Find a job you love as much as you love your valentine – check out our current opportunities at careers.ford.com  #WeAreFord #HappyValentinesDay #TogetherFordever",267,203,47,10,4,14,
https://www.linkedin.com/posts/ford-motor-company_weareford-activity-7295758639305265153-45Ha?utm_source=social_share_send&utm_medium=member_desktop_web&rcm=ACoAAFqVoVQBwS5V984XVmuyo77EUIIce7rnpa0,2025-02-13 12:00:08,Make a Ford fan's heart race with these fun valentines from the Employee Engagement and Communications team in Enterprise Technology.    Send them to anyone who drives you wild or makes the road a little smoother!  Want a job you love? You auto check out our current opportunities at http://spr.ly/6046IeVSu!   #WeAreFord,253,227,17,6,9,22,"https://media.licdn.com/dms/image/v2/D5610AQH9H1-fgES-tQ/image-shrink_800/B56ZT.9zMoHEAc-/0/1739444401408?e=1747479600&v=beta&t=LpWJT3LjLPQxFJUUEJOBJmR1jQ_dIR5yY7ZypM9Mum8, https://media.licdn.com/dms/image/v2/D5610AQHroXTiSL338Q/image-shrink_800/B56ZT.9zVCHQAc-/0/1739444402221?e=1747479600&v=beta&t=-8aDGwxuw6rBgSsTLHCINGRczBuqAXxocub9bUgRJQM, https://media.licdn.com/dms/image/v2/D5610AQFQHDAv13e6bA/image-shrink_480/B56ZT.9zf3HsAk-/0/1739444402703?e=1747479600&v=beta&t=2Oe5fdu1xf2EvZzEA11O2HcE1F0LeafUdnulB-oBxuo, https://media.licdn.com/dms/image/v2/D5610AQE9K3GcACz6pQ/image-shrink_480/B56ZT.9zqMGoAk-/0/1739444403564?e=1747479600&v=beta&t=Rpho99y4vB-xRBOznMp0SnIH00yFNd9-ouuSMXsKHV8, https://media.licdn.com/dms/image/v2/D5610AQEje_motStfFQ/image-shrink_800/B56ZT.9z2DGoAc-/0/1739444404246?e=1747479600&v=beta&t=dxCceVyQopA5uJs5tnm4nwn9zfaa-Hz4sz4KPwE8A4A, https://media.licdn.com/dms/image/v2/D5610AQEobGCKpan7HQ/image-shrink_1280/B56ZT.90AmGQAU-/0/1739444405118?e=1747479600&v=beta&t=oxd4pek65VBbXoQYfGFUtUwrqiBTM2GMR14itaQCJf4, https://media.licdn.com/dms/image/v2/D5610AQHBjnQBX4b3kQ/image-shrink_1280/B56ZT.90LYGQAQ-/0/1739444405788?e=1747479600&v=beta&t=PQgOkNJTG7eRr82si_AbobXKMjRkO5noCfj4jcnJqPo, https://media.licdn.com/dms/image/v2/D5610AQE3nPy39arrGw/image-shrink_800/B56ZT.90WLHoAk-/0/1739444406501?e=1747479600&v=beta&t=cqPpIcLxmLli2Qc8lGcuyBLeR_F0zqG_khNYrTLc8jA"
https://www.linkedin.com/posts/ford-motor-company_weareford-ev-activity-7295519942001471488-TduQ?utm_source=social_share_send&utm_medium=member_desktop_web&rcm=ACoAAFqVoVQBwS5V984XVmuyo77EUIIce7rnpa0,2025-02-12 20:11:38,"“These are go-anywhere, do-anything vehicles, so my mission is to share that feeling with our customers,” says Ford engineer and EV enthusiast Robert Hayes.   Hayes has racked up 70,000 miles in the last three years on a personal odyssey in his Mustang Mach-E in his quest to improve the electric experience for everyone. Find out what he’s learned so far.  Do you have a passion for technology and improving the customer experience? Learn more at www.careers.ford.com.   #WeAreFord #EV",844,765,34,30,64,14,
https://www.linkedin.com/posts/ford-motor-company_workplacedesign-employeewellness-weareford-activity-7318981691409158144-PWBb?utm_source=social_share_send&utm_medium=member_desktop_web&rcm=ACoAAFqVoVQBwS5V984XVmuyo77EUIIce7rnpa0,2025-04-18 15:00:15,"The Edsel B. Ford II Experience Center (FXC) thoughtfully blends modern workspace with natural elements, and its location bridges history and the future.  Experience work environments designed for you. Learn more about current opportunities at careers.ford.com  #WeAreFord #FordLand",271,256,11,0,17,7,
https://www.linkedin.com/posts/ford-motor-company_on-this-day-61-years-ago-automotive-history-activity-7318701514175172608-cms2?utm_source=social_share_send&utm_medium=member_desktop_web&rcm=ACoAAFqVoVQBwS5V984XVmuyo77EUIIce7rnpa0,2025-04-17 20:26:55,"The Ford Mustang is better than ever at 61, dominating both U.S. and global sports car sales charts. Share your favorite Ford Mustang in the comments, whether it’s in your driveway, on the track, or still in your dreams! Happy birthday to a true classic.  Would you like to help make the best even better? Learn more about current openings at careers.ford.com  #WeAreFord #FordMustang #NationalMustangDay",1272,1117,103,44,44,56,
https://www.linkedin.com/posts/ford-motor-company_ford-manufacturing-hr-activity-7311037401290719232-Zgc_?utm_source=social_share_send&utm_medium=member_desktop_web&rcm=ACoAAFqVoVQBwS5V984XVmuyo77EUIIce7rnpa0,2025-03-27 15:52:28,"2025 is the Year of Transformation for the Ford Manufacturing team, and HR is proud to be a part of the journey. By collaborating closely with every team member—from directors to hourly workers—we foster strong connections that drive world-class manufacturing.  Our HR team is stepping into a more people-centric, strategic role to build a culture that supports and empowers every employee who steps into a plant.   Want to be part of this exciting transformation?   Explore our open HR positions: http://spr.ly/6042FGy4M  #WeAreFord #NowHiring #ManufacturingHR",368,319,20,28,17,29,https://dms.licdn.com/playlist/vid/v2/D5610AQEckdWzxwUuaw/mp4-720p-30fp-crf28/B56ZXYFd7AHQBs-/0/1743087141000?e=1747479600&v=beta&t=vKZXcHnERfrmCbHhUtT3RVZ-oOawNw47lvll3sCIkUI
https://www.linkedin.com/posts/ford-motor-company_blueovalbatterypark-hiring-ford-activity-7293323683962503171-LJPb?utm_source=social_share_send&utm_medium=member_desktop_web&rcm=ACoAAFqVoVQBwS5V984XVmuyo77EUIIce7rnpa0,2025-02-06 18:44:29,"Ford BlueOval Battery Park Michigan celebrated a major construction milestone at the end of 2024. The Topping Out ceremony marked the completion of steel erection on the primary building and a key milestone in the construction of this state-of-the-art battery manufacturing facility.  As the facility's construction progresses, we're growing the team. Are you ready to tackle complex challenges and contribute to cutting-edge manufacturing? We're hiring passionate individuals to join us in revolutionizing the future of mobility.  Visit our careers page and apply today: http://spr.ly/6042I1GQu  #BlueOvalBatteryPark #Hiring #Ford #EV #Sustainability #JoinTheTeam #BOBPM",669,619,15,32,20,29,"https://media.licdn.com/dms/image/v2/D5610AQHQ5Oy8ftinug/image-shrink_1280/B56ZTcXO4UHsAQ-/0/1738863866062?e=1747479600&v=beta&t=lzKL0UbTkz-tMzlJ2pSOYvSRVO5ctCfuhGv144G0qD0, https://media.licdn.com/dms/image/v2/D5610AQE6jZQ4w8U0TA/image-shrink_1280/B56ZTcXPCTHoAM-/0/1738863866540?e=1747479600&v=beta&t=0hr9V120L0RL7AlaOLG1CmzSG1ObpzyVmUaubwI65Ug, https://media.licdn.com/dms/image/v2/D5610AQFSgZUsN9nRdA/image-shrink_1280/B56ZTcXPKjGUAU-/0/1738863867916?e=1747479600&v=beta&t=DUNblBu-RxIqbz2GS5OUFR_taSfT630zM1nb0_QiAO4, https://media.licdn.com/dms/image/v2/D5610AQHGfPA3MDq3EA/image-shrink_1280/B56ZTcXPdFGUAc-/0/1738863868574?e=1747479600&v=beta&t=udxqJqd8A1L9fx9gO0PkDx8TeaLs52dPYOZsdOftrJ0"
https://www.linkedin.com/posts/ford-motor-company_worldcancerday-activity-7292553864610762753-HS1-?utm_source=social_share_send&utm_medium=member_desktop_web&rcm=ACoAAFqVoVQBwS5V984XVmuyo77EUIIce7rnpa0,2025-02-04 15:45:30,"""The Ford SupportBelt is a product that helped my mom, but it’s also a lifeline – a tangible reminder that someone cares, that there are people actively trying to make difficult situations better."" - Jackie Kovalcik   Read her story in honor of #WorldCancerDay: https://lnkd.in/e7A5Ci4P",618,521,49,28,14,25,"https://media.licdn.com/dms/image/v2/D4E22AQHWnl-4ws2R0w/feedshare-shrink_2048_1536/B4EZTRbFlgHcAo-/0/1738680329564?e=1749686400&v=beta&t=VrxnIdn_99UsPB0rB417HS_L5fagefeWKNjMScGY2gA, https://media.licdn.com/dms/image/v2/D4E22AQEu6t0JG_tEBA/feedshare-shrink_2048_1536/B4EZTRbFkrGwAo-/0/1738680327467?e=1749686400&v=beta&t=x1DgqIVWGHiYrAxFUP1F1WaHt0nS9lz-722ks04WaYs, https://media.licdn.com/dms/image/v2/D4E22AQF6LacCmdRN1Q/feedshare-shrink_1280/B4EZTRbFkrHgAs-/0/1738680327622?e=1749686400&v=beta&t=oQ7igA9WhoDF9t9HYWH_x38LL6gzdfxRovVl-sEfR7I"
https://www.linkedin.com/posts/ford-motor-company_weareford-innovation-softwareengineering-activity-7300173197633536000-AurI?utm_source=social_share_send&utm_medium=member_desktop_web&rcm=ACoAAFqVoVQBwS5V984XVmuyo77EUIIce7rnpa0,2025-02-25 16:22:00,"You never know what will spark your career goals. Glad you decided to join us, Gargi!     Visit careers.ford.com for your chance to join the Ford team and make a career like Gargi.    #WeAreFord",159,139,8,12,28,4,
https://www.linkedin.com/posts/ford-motor-company_weareford-newhirespotlight-activity-7291202439825829891--Y4H?utm_source=social_share_send&utm_medium=member_desktop_web&rcm=ACoAAFqVoVQBwS5V984XVmuyo77EUIIce7rnpa0,2025-01-31 22:15:25,"“I have always loved the company and the people here, so when I was ready to return to the workforce, it was a given that I’d consider Ford,” says Emily Ferrara, integrated marketing manager for Ford Pass and Lincoln Way.  After relocating to another state and having children, she is thrilled to be back “engaging with former colleagues, using my expertise and working remotely, which provides a great work-life balance. My team is full of incredibly smart people to learn from, too.”  Emily is part of the Integrated Services team’s efforts to share all the great benefits customers can gain by downloading the Ford Pass and Lincoln Way apps. “I've been able to jump back in and apply my Ford-based knowledge, while learning something new and fresh about apps and the technology we offer. I’m also encouraged to see the use of AI and new ways of working that didn’t exist during my last tenure here. It's been fun, new and familiar at the same time!”  Emily calls herself “a Ford girl through and through”—her grandfather worked for Ford and her husband’s parents met on the assembly line in Wixom. “Our family was quite literally created from the blue oval in a sense, and I’m honored that I can add my chapter to our Ford story.”  As any parent knows, spare time is rare, but she has managed to pick up a hobby recently. As a new DIY enthusiast, she has accumulated a collection of power tools, saws and other equipment and is busy transforming her family’s home into their dream space (check out her handiwork in the pictures.) Next project: finishing the basement!  Whether you’re re-entering the workforce or looking for a new challenge, you can start your next chapter at Ford. Learn more at http://spr.ly/6044xWxYC   #WeAreFord #NewHireSpotlight",497,448,26,20,14,8,"https://media.licdn.com/dms/image/v2/D5610AQFWknpzcB7YAQ/image-shrink_1280/B56ZS.N6cvHQAM-/0/1738358107349?e=1747479600&v=beta&t=4ClVe3KMwmqaSwbnF6bpm8y3cMKnWzlWprFVTJEPvtk, https://media.licdn.com/dms/image/v2/D5610AQE68rCW1CVuHw/image-shrink_1280/B56ZS.N6p8GoAQ-/0/1738358108685?e=1747479600&v=beta&t=JnRs3rf2Wm7L1U4RtU1p65cYHbPL5PoQOqPK5VuGCWA, https://media.licdn.com/dms/image/v2/D5610AQH-jdPX6CSOIg/image-shrink_1280/B56ZS.N6.GHsAY-/0/1738358110284?e=1747479600&v=beta&t=qQ8TsPgfkNOpl5sLgqjv_veQKXcnH_dt3omSzRFRsYs, https://media.licdn.com/dms/image/v2/D5610AQHinDnd4VdYeA/image-shrink_1280/B56ZS.N7STHEAQ-/0/1738358114443?e=1747479600&v=beta&t=vES9HQ1tK47m9Rr8kak5SdxFregbmUSGe7Zj0wZOnzQ"
https://www.linkedin.com/posts/ford-motor-company_weareford-facesofford-activity-7289766371847024641-P_SQ?utm_source=social_share_send&utm_medium=member_desktop_web&rcm=ACoAAFqVoVQBwS5V984XVmuyo77EUIIce7rnpa0,2025-01-27 23:09:00,"Ford Australia’s Anqi Li says vehicles are so much more than just transportation now, and she uses her design expertise to give customers both practical solutions and stellar experiences. Find out which feature the interior designer is most proud of and what she designs when she’s not at work.  Would you like to work with visionary teammates like Anqi? Learn more at  careers.ford.com   #WeAreFord #FacesofFord",228,211,8,8,3,7,
https://www.linkedin.com/posts/ford-motor-company_weareford-volunteer-activity-7298717246787358721-YCId?utm_source=social_share_send&utm_medium=member_desktop_web&rcm=ACoAAFqVoVQBwS5V984XVmuyo77EUIIce7rnpa0,2025-02-21 15:56:35,These Ford Credit team members helped get winter coats to kids in need.    What would you do with your company-paid volunteer time?   #WeAreFord #FordCredit #FordofCanada,154,138,10,6,4,1,
https://www.linkedin.com/posts/ford-motor-company_ford-new-hire-alison-corporate-orientation-activity-7307755402417385472-Tf2X?utm_source=social_share_send&utm_medium=member_desktop_web&rcm=ACoAAFqVoVQBwS5V984XVmuyo77EUIIce7rnpa0,2025-03-18 14:30:59,"Alison Epler is one of the first faces you’ll see when you join Ford. As Ford’s corporate orientation facilitator, she’s greeted over 2,000 new employees – and gets to meet more every week! After working in education for most of her career, she was looking for a new chapter and she says she was pleased to find that Ford aligned with her values.  Ready to start a new chapter like Alison? Learn more at http://spr.ly/604809tK0   #WeAreFord #NewHireSpotlight",282,252,15,12,4,17,https://dms.licdn.com/playlist/vid/v2/D5610AQGld49lQfd0bg/mp4-720p-30fp-crf28/B56ZWpcnjjGQBs-/0/1742304656510?e=1747479600&v=beta&t=CfGcg_qSydHjUohWpfqK0zSrQqFqo8Ud7EvgxET3fFM
https://www.linkedin.com/posts/ford-motor-company_weareford-golions-activity-7286092745977339904-ucR2?utm_source=social_share_send&utm_medium=member_desktop_web&rcm=ACoAAFqVoVQBwS5V984XVmuyo77EUIIce7rnpa0,2025-01-17 19:51:19,"Congratulations to the Detroit Lions on achieving No. 1 seed and back-to-back NFC North championships! What better way to celebrate than with Ford employee John Legardy’s original hype music “All Grit”?  Legardy, a door line operator at Flat Rock Assembly Plant, wrote the song as a favor to a friend who wanted a little something to get his Detroit Lions home-opener tailgate party going. Next thing he knew, Lions fans everywhere couldn’t get enough of the song.  Give it a listen: http://spr.ly/6044acuPg  This wasn’t a fluke – he got his start when he saw the need for clean hype songs before his son’s Little League football games, and ever since he’s been writing and composing music for professional sports teams and in every genre.  Would you like to work with talented teammates like John? Join us at http://spr.ly/6046acuPi   #WeAreFord #GoLions",697,645,19,31,13,15,"https://media.licdn.com/dms/image/v2/D5610AQGgZI7t-l4Fxg/image-shrink_1280/image-shrink_1280/0/1737139878854?e=1747479600&v=beta&t=6l7XEWgv7XNT6iWMa3vjFecTTVcWBaxJXumR17L4UH8, https://media.licdn.com/dms/image/v2/D5610AQGjM9dtiyRoUA/image-shrink_1280/image-shrink_1280/0/1737139879037?e=1747479600&v=beta&t=KPRmq2pYBez1RUm2ShXDtpnoyiabYKpw12fFjFX6pHg"
https://www.linkedin.com/posts/ford-motor-company_weareford-facesofford-activity-7285340050219839488-w-ij?utm_source=social_share_send&utm_medium=member_desktop_web&rcm=ACoAAFqVoVQBwS5V984XVmuyo77EUIIce7rnpa0,2025-01-15 18:00:23,"Kianna M. says accepting a full-time job in the Supply Chain Ford College Graduate program was an easy decision after finishing her MBA. Mateen says she gets to see her work on a global scale and truly feels she’s helping to “build a better world.” Find out more about Kianna, the freshman year paper that sparked her interest in Ford, and why she may look familiar to Metro Detroit drivers!  Would you like to launch a career with real impact? Learn more at  careers.ford.com.   #WeAreFord #FacesOfFord",383,338,20,24,18,13,
https://www.linkedin.com/posts/ford-motor-company_fordland-smartworkplaces-employeewellness-activity-7316565713966546946-zM9-?utm_source=social_share_send&utm_medium=member_desktop_web&rcm=ACoAAFqVoVQBwS5V984XVmuyo77EUIIce7rnpa0,2025-04-11 23:00:01,"Work smarter, not harder, on site thanks to Ford Land’s thoughtful design.  Want to collaborate in state-of-the-art facilities? Learn more at www.careers.ford.com.   #WeAreFord #FordLand",308,287,11,7,9,8,
https://www.linkedin.com/posts/ford-motor-company_did-you-know-that-85-of-electric-vehicle-activity-7282749717459963904-fBxz?utm_source=social_share_send&utm_medium=member_desktop_web&rcm=ACoAAFqVoVQBwS5V984XVmuyo77EUIIce7rnpa0,2025-01-08 14:27:19,"Did you know that 85% of electric vehicle charging happens at home? After the successful launch in October last year, Ford Power Promise complimentary home charger and standard installation has been extended into 2025. The program has helped customers in all 50 states charge their Ford electric vehicles at home.   Read more from Stacey Ferreira , Director, Retail Execution & Innovation, on the insights driving how we’re supporting customers when choosing to go electric.",703,659,19,17,34,48,
https://www.linkedin.com/posts/ford-motor-company_ford-newhirespotlight-brian-fontaine-activity-7302387566152990720-7ayC?utm_source=social_share_send&utm_medium=member_desktop_web&rcm=ACoAAFqVoVQBwS5V984XVmuyo77EUIIce7rnpa0,2025-03-03 19:01:07,"Account manager Brian Fontaine recently joined Ford Pro, and to him, Ford isn’t just another company – it’s quite literally the reason he exists!  Would you like to be part of a company with a long history and a bright future? Learn more at http://spr.ly/6040LqdVe  #WeAreFord #NewHireSpotlight",271,246,14,10,17,21,https://dms.licdn.com/playlist/vid/v2/D5610AQFmeJciStSxuA/mp4-720p-30fp-crf28/B56ZVdKqI9GoCA-/0/1741024862972?e=1747479600&v=beta&t=OKwalZ6htvTYSHOFQ4jBO05GnEtyeQz-sX9Emcl2u4Y
